{
  "$schema": "http://json-schema.org/draft-07/schema#",
  "type": "object",
  "additionalProperties": false,
  "required": [
    "imagePullSecrets",
    "database",
    "options",
    "components"
  ],
  "properties": {
    "imagePullSecrets": {
      "type": "array",
      "items": {
        "type": "object",
        "additionalProperties": false,
        "required": [
          "name"
        ],
        "properties": {
          "name": {
            "type": "string",
            "minLength": 1
          }
        }
      }
    },
    "database": {
      "type": "object",
      "additionalProperties": false,
      "required": [
        "existingSecret",
        "passwordKey",
        "user",
        "name",
        "storageClass",
        "storageSize"
      ],
      "properties": {
        "existingSecret": {
          "type": "string",
          "minLength": 1,
          "maxLength": 253,
          "pattern": "^[a-z0-9]([a-z0-9.-]*[a-z0-9])?$"
        },
        "passwordKey": {
          "type": "string",
          "minLength": 1
        },
        "user": {
          "type": "string",
          "minLength": 1
        },
        "name": {
          "type": "string",
          "minLength": 1
        },
        "storageClass": {
          "type": "string",
          "minLength": 1,
          "maxLength": 253,
          "pattern": "^[a-z0-9]([a-z0-9.-]*[a-z0-9])?$"
        },
        "storageSize": {
          "type": "string",
          "minLength": 1,
          "pattern": "^[1-9][0-9]*(Gi|Mi)$"
        }
      }
    },
    "options": {
      "type": "object",
      "additionalProperties": false,
      "required": [
        "a",
        "b"
      ],
      "properties": {
        "a": {
          "type": "string",
          "minLength": 1
        },
        "b": {
          "type": "string",
          "minLength": 1
        }
      }
    },
    "components": {
      "type": "object",
      "additionalProperties": false,
      "required": [
        "vote",
        "result",
        "worker",
        "redis",
        "postgres"
      ],
      "properties": {
        "vote": {
          "type": "object",
          "additionalProperties": false,
          "required": [
            "image",
            "resources"
          ],
          "properties": {
            "image": {
              "type": "object",
              "additionalProperties": false,
              "required": [
                "repository",
                "tag",
                "digest",
                "pullPolicy"
              ],
              "properties": {
                "repository": {
                  "type": "string",
                  "minLength": 1,
                  "pattern": "^[a-z0-9][a-z0-9./_-]*$"
                },
                "tag": {
                  "type": "string",
                  "pattern": "^[a-zA-Z0-9_][a-zA-Z0-9_.-]{0,127}$"
                },
                "digest": {
                  "type": "string",
                  "pattern": "^(sha256:[a-f0-9]{64})?$"
                },
                "pullPolicy": {
                  "enum": [
                    "IfNotPresent",
                    "Always",
                    "Never"
                  ]
                }
              }
            },
            "resources": {
              "type": "object",
              "additionalProperties": false,
              "required": [
                "requests",
                "limits"
              ],
              "properties": {
                "requests": {
                  "type": "object",
                  "additionalProperties": false,
                  "required": [
                    "cpu",
                    "memory"
                  ],
                  "properties": {
                    "cpu": {
                      "type": "string",
                      "pattern": "^[1-9][0-9]*m?$"
                    },
                    "memory": {
                      "type": "string",
                      "pattern": "^[1-9][0-9]*(Mi|Gi)$"
                    }
                  }
                },
                "limits": {
                  "type": "object",
                  "additionalProperties": false,
                  "required": [
                    "cpu",
                    "memory"
                  ],
                  "properties": {
                    "cpu": {
                      "type": "string",
                      "pattern": "^[1-9][0-9]*m?$"
                    },
                    "memory": {
                      "type": "string",
                      "pattern": "^[1-9][0-9]*(Mi|Gi)$"
                    }
                  }
                }
              }
            }
          }
        },
        "result": {
          "type": "object",
          "additionalProperties": false,
          "required": [
            "image",
            "resources"
          ],
          "properties": {
            "image": {
              "type": "object",
              "additionalProperties": false,
              "required": [
                "repository",
                "tag",
                "digest",
                "pullPolicy"
              ],
              "properties": {
                "repository": {
                  "type": "string",
                  "minLength": 1,
                  "pattern": "^[a-z0-9][a-z0-9./_-]*$"
                },
                "tag": {
                  "type": "string",
                  "pattern": "^[a-zA-Z0-9_][a-zA-Z0-9_.-]{0,127}$"
                },
                "digest": {
                  "type": "string",
                  "pattern": "^(sha256:[a-f0-9]{64})?$"
                },
                "pullPolicy": {
                  "enum": [
                    "IfNotPresent",
                    "Always",
                    "Never"
                  ]
                }
              }
            },
            "resources": {
              "type": "object",
              "additionalProperties": false,
              "required": [
                "requests",
                "limits"
              ],
              "properties": {
                "requests": {
                  "type": "object",
                  "additionalProperties": false,
                  "required": [
                    "cpu",
                    "memory"
                  ],
                  "properties": {
                    "cpu": {
                      "type": "string",
                      "pattern": "^[1-9][0-9]*m?$"
                    },
                    "memory": {
                      "type": "string",
                      "pattern": "^[1-9][0-9]*(Mi|Gi)$"
                    }
                  }
                },
                "limits": {
                  "type": "object",
                  "additionalProperties": false,
                  "required": [
                    "cpu",
                    "memory"
                  ],
                  "properties": {
                    "cpu": {
                      "type": "string",
                      "pattern": "^[1-9][0-9]*m?$"
                    },
                    "memory": {
                      "type": "string",
                      "pattern": "^[1-9][0-9]*(Mi|Gi)$"
                    }
                  }
                }
              }
            }
          }
        },
        "worker": {
          "type": "object",
          "additionalProperties": false,
          "required": [
            "image",
            "resources"
          ],
          "properties": {
            "image": {
              "type": "object",
              "additionalProperties": false,
              "required": [
                "repository",
                "tag",
                "digest",
                "pullPolicy"
              ],
              "properties": {
                "repository": {
                  "type": "string",
                  "minLength": 1,
                  "pattern": "^[a-z0-9][a-z0-9./_-]*$"
                },
                "tag": {
                  "type": "string",
                  "pattern": "^[a-zA-Z0-9_][a-zA-Z0-9_.-]{0,127}$"
                },
                "digest": {
                  "type": "string",
                  "pattern": "^(sha256:[a-f0-9]{64})?$"
                },
                "pullPolicy": {
                  "enum": [
                    "IfNotPresent",
                    "Always",
                    "Never"
                  ]
                }
              }
            },
            "resources": {
              "type": "object",
              "additionalProperties": false,
              "required": [
                "requests",
                "limits"
              ],
              "properties": {
                "requests": {
                  "type": "object",
                  "additionalProperties": false,
                  "required": [
                    "cpu",
                    "memory"
                  ],
                  "properties": {
                    "cpu": {
                      "type": "string",
                      "pattern": "^[1-9][0-9]*m?$"
                    },
                    "memory": {
                      "type": "string",
                      "pattern": "^[1-9][0-9]*(Mi|Gi)$"
                    }
                  }
                },
                "limits": {
                  "type": "object",
                  "additionalProperties": false,
                  "required": [
                    "cpu",
                    "memory"
                  ],
                  "properties": {
                    "cpu": {
                      "type": "string",
                      "pattern": "^[1-9][0-9]*m?$"
                    },
                    "memory": {
                      "type": "string",
                      "pattern": "^[1-9][0-9]*(Mi|Gi)$"
                    }
                  }
                }
              }
            }
          }
        },
        "redis": {
          "type": "object",
          "additionalProperties": false,
          "required": [
            "image",
            "resources"
          ],
          "properties": {
            "image": {
              "type": "object",
              "additionalProperties": false,
              "required": [
                "repository",
                "tag",
                "digest",
                "pullPolicy"
              ],
              "properties": {
                "repository": {
                  "type": "string",
                  "minLength": 1,
                  "pattern": "^[a-z0-9][a-z0-9./_-]*$"
                },
                "tag": {
                  "type": "string",
                  "pattern": "^[a-zA-Z0-9_][a-zA-Z0-9_.-]{0,127}$"
                },
                "digest": {
                  "type": "string",
                  "pattern": "^(sha256:[a-f0-9]{64})?$"
                },
                "pullPolicy": {
                  "enum": [
                    "IfNotPresent",
                    "Always",
                    "Never"
                  ]
                }
              }
            },
            "resources": {
              "type": "object",
              "additionalProperties": false,
              "required": [
                "requests",
                "limits"
              ],
              "properties": {
                "requests": {
                  "type": "object",
                  "additionalProperties": false,
                  "required": [
                    "cpu",
                    "memory"
                  ],
                  "properties": {
                    "cpu": {
                      "type": "string",
                      "pattern": "^[1-9][0-9]*m?$"
                    },
                    "memory": {
                      "type": "string",
                      "pattern": "^[1-9][0-9]*(Mi|Gi)$"
                    }
                  }
                },
                "limits": {
                  "type": "object",
                  "additionalProperties": false,
                  "required": [
                    "cpu",
                    "memory"
                  ],
                  "properties": {
                    "cpu": {
                      "type": "string",
                      "pattern": "^[1-9][0-9]*m?$"
                    },
                    "memory": {
                      "type": "string",
                      "pattern": "^[1-9][0-9]*(Mi|Gi)$"
                    }
                  }
                }
              }
            }
          }
        },
        "postgres": {
          "type": "object",
          "additionalProperties": false,
          "required": [
            "image",
            "resources"
          ],
          "properties": {
            "image": {
              "type": "object",
              "additionalProperties": false,
              "required": [
                "repository",
                "tag",
                "digest",
                "pullPolicy"
              ],
              "properties": {
                "repository": {
                  "type": "string",
                  "minLength": 1,
                  "pattern": "^[a-z0-9][a-z0-9./_-]*$"
                },
                "tag": {
                  "type": "string",
                  "pattern": "^[a-zA-Z0-9_][a-zA-Z0-9_.-]{0,127}$"
                },
                "digest": {
                  "type": "string",
                  "pattern": "^(sha256:[a-f0-9]{64})?$"
                },
                "pullPolicy": {
                  "enum": [
                    "IfNotPresent",
                    "Always",
                    "Never"
                  ]
                }
              }
            },
            "resources": {
              "type": "object",
              "additionalProperties": false,
              "required": [
                "requests",
                "limits"
              ],
              "properties": {
                "requests": {
                  "type": "object",
                  "additionalProperties": false,
                  "required": [
                    "cpu",
                    "memory"
                  ],
                  "properties": {
                    "cpu": {
                      "type": "string",
                      "pattern": "^[1-9][0-9]*m?$"
                    },
                    "memory": {
                      "type": "string",
                      "pattern": "^[1-9][0-9]*(Mi|Gi)$"
                    }
                  }
                },
                "limits": {
                  "type": "object",
                  "additionalProperties": false,
                  "required": [
                    "cpu",
                    "memory"
                  ],
                  "properties": {
                    "cpu": {
                      "type": "string",
                      "pattern": "^[1-9][0-9]*m?$"
                    },
                    "memory": {
                      "type": "string",
                      "pattern": "^[1-9][0-9]*(Mi|Gi)$"
                    }
                  }
                }
              }
            }
          }
        }
      }
    }
  }
}
